"ST_SymDifference(p_a geometry, p_b geometry)",Section 8: Tier3_GeometryFunctions.sql - Define the tier 3 geometry functions,Yes,"Convex hull of (A\B union B\A). Approximate. ST_Difference(A, B) returns the part of A that is NOT inside B",Approximate,PostGIS uses GEOS for exact symmetric difference on any geometry type; supports gridSize param. YB: returns convex hull of the two differences — not a true symmetric difference.,,Give me the parts of shape A and shape B that DO NOT overlap.,205
"ST_Buffer(p_geom geometry, p_distance double precision, p_segments integer DEFAULT 8)",Section 8: Tier3_GeometryFunctions.sql - Define the tier 3 geometry functions,Yes,Point: generates circular polygon. Polygon: offsets vertices along bisector normals. Approximate.,Approximate,"PostGIS uses GEOS for precise buffer with configurable end cap/join styles (round/flat/mitre) and quad_segs. YB: point=circle approximation, polygon=rough vertex offset along bisector normals, no arc segments at corners, no style options.",,Draw a border exactly 5 miles outward around this entire shape.,206
ST_IsValid(p_geom geometry),Section 8: Tier3_GeometryFunctions.sql - Define the tier 3 geometry functions,Yes,"Checks for empty arrays, NaN/Inf coordinates, self-intersecting edges, and non-zero area for polygons.",Partial,"PostGIS uses GEOS for full OGC validity (ring orientation, nesting, duplicate rings, etc.); supports flags param for ESRI mode. YB: basic checks only (empty/NaN/self-intersection/zero-area), no flags param.",,"Check if this shape is mathematically sound (e.g., lines don't cross themselves).",207
"ST_Touches(p_a geometry, p_b geometry)",Section 8: Tier3_GeometryFunctions.sql - Define the tier 3 geometry functions,Yes,True if boundaries contact but interiors do not overlap.,Partial,"PostGIS uses GEOS DE-9IM (patterns FT*******, F**T*****, F***T****); handles all geometry types. YB: simplified boundary-distance check, no full DE-9IM.",,Do the borders of these two shapes touch without overlapping?,208
"ST_Crosses(p_a geometry, p_b geometry)",Section 8: Tier3_GeometryFunctions.sql - Define the tier 3 geometry functions,Yes,True if geometries have partial interior intersection at lower dimensions.,Partial,PostGIS uses GEOS DE-9IM; handles all dimension combinations per OGC spec. YB: simplified — only handles line-vs-polygon and line-vs-line cases.,,Does this line slice completely through this polygon?,209
"ST_Overlaps(p_a geometry, p_b geometry)",Section 8: Tier3_GeometryFunctions.sql - Define the tier 3 geometry functions,Yes,True if same-dimension geometries partially overlap and neither contains the other.,Partial,"PostGIS uses GEOS DE-9IM; handles all same-dimension geometry pairs. YB: simplified — checks intersects + neither-contains, no full DE-9IM.",,Do these two polygons partially cover each other like a Venn diagram?,210
"ST_Equals(p_a geometry, p_b geometry)",Section 8: Tier3_GeometryFunctions.sql - Define the tier 3 geometry functions,Yes,Topological equality. For polygons: mutual containment. For lines/points: same vertices in any order.,Partial,"PostGIS uses GEOS DE-9IM for topological equality; handles all geometry types. YB: mutual ST_Contains for polygons, vertex-by-vertex for lines. No multi-geometry.",,Are these two shapes physically identical in space?,211
"ST_Simplify_vw(p_geom geometry, p_area_threshold double precision)",Section 8: Tier3_GeometryFunctions.sql - Define the tier 3 geometry functions,Yes,Visvalingam-Whyatt algorithm. Removes vertices by effective triangle area.(remove dots that doesn’t change the polygon),Partial,"PostGIS Visvalingam-Whyatt handles all geometry types; supports 3D. YB: correct VW but no multi-geometry, no 3D.",,Remove visually insignificant corners to make the shape smaller.,212
geohash8_fully_within_polygon(p_hashes text[]),Section 9: GeohashPolygonFunctions.sql - Define the geohash polygon functions,No (YB custom),"Given 3-5 geohash strings that define polygon vertices, returns all precision-8 cells fully contained within it.",N/A (YB Custom),,,Find all the tiny Geohash squares that fit completely inside this large shape.,213
"geohash8_fully_within_polygon(p1 text, p2 text, p3 text, p4 text DEFAULT NULL, p5 text DEFAULT NULL )",Section 9: GeohashPolygonFunctions.sql - Define the geohash polygon functions,No (YB custom),"Given 3-5 geohash strings that define polygon vertices, returns all precision-8 cells fully contained within it.",N/A (YB Custom),,,Find all the tiny Geohash squares that fit completely inside this large shape.,214
"geohash_cells_for_bbox(p_lon_min double precision, p_lat_min double precision, p_lon_max double precision, p_lat_max double precision, p_precision integer)",Section 10: GeohashBboxFunctions.sql - Define the geohash bbox functions,No (YB custom),Enumerates all geohash cells covering a bounding box at the given precision. Core function for the two-phase query pattern.,N/A (YB Custom),,,Give me a list of all the Geohash squares that cover this large rectangle.,215
"geohash_cells_for_bbox(p_lon_min double precision, p_lat_min double precision, p_lon_max double precision, p_lat_max double precision)",Section 10: GeohashBboxFunctions.sql - Define the geohash bbox functions,No (YB custom),Enumerates all geohash cells covering a bounding box at the given precision. Core function for the two-phase query pattern.,N/A (YB Custom),,,Give me a list of all the Geohash squares that cover this large rectangle.,216
"geohash_cells_for_bbox(p_lon_min numeric, p_lat_min numeric, p_lon_max numeric, p_lat_max numeric, p_precision integer)",Section 10: GeohashBboxFunctions.sql - Define the geohash bbox functions,No (YB custom),Enumerates all geohash cells covering a bounding box at the given precision. Core function for the two-phase query pattern.,N/A (YB Custom),,,Give me a list of all the Geohash squares that cover this large rectangle.,217
"geohash_cells_for_bbox(p_lon_min numeric, p_lat_min numeric, p_lon_max numeric, p_lat_max numeric)",Section 10: GeohashBboxFunctions.sql - Define the geohash bbox functions,No (YB custom),Enumerates all geohash cells covering a bounding box at the given precision. Core function for the two-phase query pattern.,N/A (YB Custom),,,Give me a list of all the Geohash squares that cover this large rectangle.,218